"Discipline Mark Date", "Country", "ResultScore", "Competition", "Category", "Race", "Place"
Eliud KIPCHOGE, 05 Nov 1984, KEN, "Marathon, 1:59:41 , 12 OCT 2019", "AUT", "INEOS 1:59 Challenge, Prater Hauptallee, Wien", "F", "F", "1", "EXH"
Eliud KIPCHOGE, 05 Nov 1984, KEN, "Marathon, 2:02:37 , 28 APR 2019", "GBR", "1286", "Virgin Money London Marathon, London", "GL", "F", "1"
Lawrence CHERONO, 07 Aug 1988, KEN, "Marathon, 2:05:45 , 13 OCT 2019", "USA", "1232", "Bank of America Chicago Marathon, Chicago, IL", "GL", "F", "1"
Lawrence CHERONO, 07 Aug 1988, KEN, "Half Marathon, 1:04:09 , 28 JUL 2019", "COL", "1025", "Media Maraton de Bogota, Bogotá", "A", "F", "2"
Lawrence CHERONO, 07 Aug 1988, KEN, "Half Marathon, 1:00:46 *, 02 JUN 2019", "USA", "1132", "Rock 'n' Roll Half Marathon, San Diego, CA", "E", "F", "2"
Lawrence CHERONO, 07 Aug 1988, KEN, "Marathon, 2:07:57 *, 15 APR 2019", "USA", "1175", "B.A.A. Boston Marathon, Boston, MA", "GL", "F", "1"
